filename,size,timestamp,downloads,type,version,dependencies,description,status,DL_per_day,megabytes
Bad_Moon_Rising,23485914,1708920348,1106,campaign,1.18.3,"Archaic_Era,Archaic_Resources,Archaic_Sounds","An expedition to gather treasure from the cold north sets off compounding disaster.  Follow a prisoner of the undead in his quest for revenge, then join a rebellion, learn to get along with the natives, and save the world.

SP Campaign in three parts, though Part 1 is very quick and is an introduction to the inventory/equipment system.  
Long campaign, design is a bit more like old JRPGs in Parts 2 and 3.  Requires 'Archaic Era', 'Archaic Resources', and 'Archaic Sounds' add-ons

Known problems:  
 - Has some issues with GUI widget size and scrollbars at smaller resolutions  
 - The state of some translations is questionable.

If you have any comments, either good or bad, please leave a note at the forums.wesnoth.org link.",,12.1649289512207,22.397912979126
Rustling_in_the_Wind,17582645,1711064819,406,campaign,2.1.8,"","The Forests of Bright Shade are dying. The former sanctuary of elven race and its wose friends lies soaked by the dark powers feeding on the goodness of this place. Join Laneenfe the elvish priestess and her squad made of mysterious daredevils to overcome evil sprouted in the sacred lands of their kind.

(Intermediate level, 8 scenarios - 5 battle and 3 story-only scenarios.)",,6.14250347501544,16.7681169509888
Mages_University_alternative,18568805,1715184544,128,campaign,0.0.3,,"Embark on a journey with Ivesi far south of Wesnoth, in the Faehen Empire. Witness the fall of the theocracy as he strives to establish a new university of magic. Join Ivesi in a captivating tale of ambition, resilience, and the pursuit of knowledge in a world filled with challenges and mysteries...
15 scenarios.",,6.95092081222294,17.708592414856
Ascension,17746676,1712719069,247,campaign,1.2.4,,"The orcish homeland is gripped in a spiral of blood feuds and revenge raiding.  Can a mysterious stranger's offer of new lands to conquer allow the orc Brurbar to bring renewed glory and power to the ragged orcish clans?",,5.26086917936476,16.9245491027832
Strange_Legacy_Light,15256071,1711195217,185,campaign,1.16.26.1,,"Strange Legacy Light: 
<i>This is the light version of Strange Legacy, with a smaller size, but no portraits, story images and sounds. 
For a better experience with portraits and included sounds, you can download the full version.</i>

The Orc invasion came without warning and with a brutality that caught the Human Alliance completely off guard and unprepared for. Before the year was over the Orcs controlled half of the Northland. The Winter finally halted their advance. Meh, what's the big deal. I never cared much for politics or policy. But when my uncle was gone, I started into the greatest adventure of my life.

This campaign is a classical rpg that offers a variety of options, you will just control one hero and bring him to fortune. You can trade, pickpocket, be a bard, bounty- or treasurehunter, or working as a craftsman selling your goods. You can also run a building and upgrade it or doing random generated missions. There are a lot of ways to make a fortune. But the world around isn't always friendly and it will react on your character level. You might encounter thieves, orcs, bandits or wild animals and therefore you will need a proper equipment to defend yourself.

Equip your charcter with: helmets, armors, shoes, shields, instruments, rings, amulets, ranged or meleeweapons or learn more than 80 powerful spells to gain an advantage. Hire one of 35 mercs to defend your load and recall them using your warhorn. Try to conquer an enemy town to gain a constant tax income. Encounter all kind of enemies each on changing maps, according to the terrain - even your ship might be attacked by naga warriors or dangerous pirates. Follow the storyline with 34 missions that will force you to explore the world of Strange legacy. A new amla system will allow you to create a character in the way you like him, allowing you to solve the game differently each time you play and the difficulty is increasing with each level up. 
For the most recent changes check the forum thread. Equip your uncles house with furniture allowing you to craft weapons, armors and cook food. If you like to have a classic RPG try out the RPG Mode. Have fun! 



(1.16.23.1 23/04/01: light version of Strange Legacy with a way smaller size
1.16.23.2 smaller fixes
1.16.24 new fishing and skill mechanics, graphic improvement, fishmarket
1.16.24.1 smaller fixes
1.16.24.2 minor changes, dishes added
1.16.24.3 bugfixes, companions upgrade
1.16.24.4 bugfixes concerning rpg mode, animal decorations
1.16.25 bugfixes, animal pet options, better stamina abilities
1.16.26.1 bugfixes, overworked building mechanics",,2.86432722716495,14.5493230819702
The_Bees_Journey,16088742,1709731817,281,campaign,24.03.23,,"That summer, the hornets invasion destroyed the Kingdom of Bees. You, the princess, must lead the bees on their journey to rebuild the homeland.

(Unfinished, 8 scenarios completed.)",,3.44679154679711,15.3434200286865
The_Nameless_Fellowship_Saga,20294324,1711205777,475,campaign,1.4.2,,"A dunefolk centered campaign with some strange issue, set in the Sandy Wastes, and surroundings, during the time of the Mal-Ravanal invasion.

It's advisable to read all the dialogues carefully to understand the game and the story.

The campaign is complete, and it's even fully tested, at least at normal difficulty, but there is always the Murphy's law.

(Intermediate level, 36 scenarios.)

advice:
The author has no intention of participating in a forum in which the moderators deem admissible a campaign like Russia Conquests,
and the same moderators deem inadmissible a harmless discussion about green trolls.
Therefore any error reports must be sent directly to the email argesilao2019@yahoo.com

logs:
1.0.1
Fixed incorrect description about isawati's special ability to cure allied units
Fixed Troll Shaman - Troll Sorcerer issue in scenario 16

1.0.2
Fixed surians counter's issue in scenario 23 (The Convoy)

1.1.0
Fixed the error that prevented some important events in scenario 26 (the Battle for Qalaba) from taking place

1.2.0
Fixed the error in scenario 34 (The Hidden valley): replaced passive_leader=yes with max_moves=0 so orc leaders don't leave their keep, and therefore they can't be killed outside their keep; when this happened Dundrain the dwarf was not released, and it was not possible to finish the scenario.
Fixed minor issue in the same scenario

1.3.0
Added the Italian Translation
fixed a lot of minor typos

1.3.1
Minor change in dialogues and fixed some typos in Italian translation
fixed the skeleton archer typos in scenario 09 (The Canyon of the Undead)
fixed the error which make not appears the Troll Chief in scenario 16 when playing in Italian
fixed the possible error in the FRAB Sorcerer advancement

1.3.2
Fixed two errors which appears in scenario 2 when selected the HARD difficulty

1.3.3
Fixed the error in scenario 27 (Sumir Last Stand) which prevented Clitus and/or Gerbal from being saved if they were killed and couldn't move

1.3.4
Fixed a bug in the rats' respawn in scenario 12 (Maqadash Underground)

1.4.0
scenario 26: Sumir is now a passive leader even in HARD difficulty; Kycilia has a limitated mobility to avoid suicidal behavior
			 Deprecated the drawbridge's option
			 Changes in Sumir's side behavior and composition
scenario 27: Fixed three falcon->Falcon bugs in HARD difficulty
			 no more used Hell Bat
Fixed various weird aggression's values
units: higher castle's defense for Wallkeeper and Gatekeeper (50%->60%)
	   lower HP for Undead Catapult (50->40)

1.4.1
scenario 31: More castle tiles for undead's side
scenario 35: More cautious behavior for the enemy leaders
			 new income for enemies side
units: Higher HP and doubled attaks for Smoking Tower

1.4.2
allowed Saurian Skirmisher to level up like Saurian Spearthrower
",,7.36829707594948,19.354175567627
Drums_of_War,23262089,1712746467,237,campaign,2.0.4,,"For five years the kingdom of Anduria has been at war.
The orc warlord, Sreng, has pushed the realm to its limits.
King Ethylin-Mor gathers the heroes of Anduria for one last effort to rid the land of this plague once and for all.
If Anduria is to survive, Sreng must die.
(6 scenarios: Beginner - Intermediate Level)

This upload is part of vghetto port project.
",,5.08220409528835,22.1844568252563
LSB,25887881,1709632287,569,campaign,1.0.1,,"The first orcs from the far west were far more powerful than later generations.
So why did they not conquer all of the Great Continent?
And how did they lose or forget so much heritage and lore?

Set in the early years of Wesnoth, you command the few denizens of the far north who faced the overwhelming might of the horde.
Why is this story not known?
Did the defenders win?
And if so, how?
This is their story.

Intermediate difficulty classic skirmish style campaign with enhanced recruitment options plus a few surprises.
16 scenarios, 14 playable of which 13 will actually be played depending on choices made.

Complete, playable, only tested on normal difficulty.
Comments/feedback greatly appreciated.

1.0.1
- Various bugfixes and dialogue tweaks (gameplay changes are minor).
  Added context menu item to display combat training progress.
  Thanks to Konrad2.

1.0.0
- Added suggestions, tweaks and bug fixes.
  Thanks to white_haired_uncle and Sandsculpture.
- Scenario 13 redesigned, otherwise gameplay largely unchanged.",,6.88219923066348,24.6886072158813
To_Lands_Unknown,52786336,1708783054,2795,campaign,3.10.0,"Era_of_Magic,To_Lands_Unknown_Resources_1,To_Lands_Unknown_Resources_2","Hear the story of Mehir, a young city guard from al-Kamija - an isolated city in the middle of the Great Desert, where people and jinn live together. Reveal Mehir's destiny, visit many exotic places, encounter strange nations and learn about their intentions.

This is the most visually sophisticated add-on ever created for the Battle for Wesnoth. It has the following features:
- multihex terrain visuals (images covering entire maps to simulate height for example)
- animated cutscenes (video clips)
- more than 200 unique animated units (all from the Era of Magic add-on)
- a completely different universe, not BfW-related
- an innovative map screen which keeps track of player's achievements
- a special gameplay mode offering an alternative story progression
- custom music

(25 scenarios, some of which are dialog-only - Requires 'Era of Magic' add-on)

If you encounter any bugs, please notify the campaign author, so the patch can be delivered.

If you have problems with downloading this add-on, try using add-on server web interface:
http://addons.wesnoth.org

If you enjoy the add-on and wish to support its development further, you can now do so at:
https://ko-fi.com/inferno8",,30.2142087406355,50.3409729003906
SXRPG,29306154,1715440367,92,campaign,6.0.5b,,"SX RPG ADDON is a stand-alone multiplayer ADD ON for Battle of Wesnoth.

!!Doza min doza teye!!!

What does SX mean:
-----------------------------------

Originally SX meant --Survival Extreme-- which became throughout the history of wesnoth-add-ons a synomyn
for maps that feature stand-alone-Heroes, that can be upgraded in so-called --shops--, fighting against an army of creeps,
which constantly increase in strengh while the game proceed. For killing creeps players are granted with gold, that
is used on their side to upgrade their heroes as well, to keep up with stonger creeps and to finally kill the ai leaders.
Gold from killing creeps will be generally given to ALL players. So no matter who kills the creeps, its always a good thing.

A major fun factor is that players gain additional temporary moves and attacks from killing enemy units,
so they are able to perform well planned killing streaks that bring even more gold to the players.

In order to win, players had to kill all enemy leaders, which were boosted in strengh greatly.
Players need to grow stronger from killing creeps and/or find gold from other sources to achieve this goal.
All 10ish turn ai als release a batch of bosses, exceptional strong units, which need some teamplay to win against,
or a very well developed single hero.


SXRPG ADDON:
--------------------------------

Featuring SXgameplay with RPG elements.

While SX is a basic hack-n-slay rpg-like approach, which attracted many players,
SXRPG features elaborated maps, adding adventure and dungeon-exploring gameplay to it.

On Top of the already existing differences among the different units,
SXRPG adds 6 classes of Warriors, Clerics, Rangers, Mages,
Rogues and Roguemages all with different strenghs and weaknesses.

It contains so far 6 elaborated Maps/Scenarios which need 80 to 120 turn to finish in average.
Each scenerio in this ADD ON is an adventure for 1 - 5 players. Any number of Players is welcome.

Less players means more Gold for each player to get started with. While less players get more gold at start,
but it is obvious that more players means more total income, since all players get the gold for killing creeps.

As a special Feature you can define the -Starting Level- in -advanced Options- in Game-Creation-Menu,
default is 0, but for more elaborated starting-Heroes you can chose higher Starting Levels.
The higher the starting Level, the higher the starting gold, but all enemies also rise accordingly
to the Level. I.E.: on lvl-0-start mobs start also at lvl 0, at lvl-4-start mobs start at lvl 4.
(Level is NOT the default level of wesnoth units, instead a sx-dependent measure for stat multipliers)
Starting at different Levels may change the Gaming Expierience and Gameplay.

This Map-Pack also features new units, new terrain, theres an additional soundfile.
The stuff included was mostly done by parts of the wesnoth-community and hopefully put to good use here.
Credits goes out to all who find their work here implemented. Thx to all contributors.

Big thx to all playtesters and people who gave suggestions. Many things implemented were suggested by
players and without these ideas SXRPG would be a lot different. :)

Have Fun.
Give Feedback in SXRPG Thread in Wesnoth.org Forums",,5.95318517275831,27.9485263824463
Forgotten_Conflicts,30699029,1711472721,316,campaign,1.1,,"These are tales long lost in the shadows of the past. Some of valor, others of loss and betrayal. Knitting together fragments of the past, the battles shall reveal the strife of ones disregarded by the keepers of our lore.

(Expert level, 12 scenarios.)",,5.14861403196461,29.2768754959106
Tunnel_Wars,44241269,1714573460,400,campaign,"18.0.1 beta",Halfelven,"Sapper heroines and heroes who must perform seek and destroy missions in urban areas and hostile underground to defend their nation against a sneaking up fanatical threat from the dark and dank below. Learn valuable tactics in urban warfare. A halfelven campaign.",,15.6939319975024,42.19176197052
